{
  "session_id": "is_client_kyc",
  "idea_id": "idea_client_kyc",
  "mode": "as_is",
  "process_id": "proc_client_kyc_to_be",
  "as_is_process_id": "proc_client_kyc_as_is",
  "to_be_process_id": "proc_client_kyc_to_be",
  "requester_user_id": "user_sarah_lin",
  "source_id": "src_intake_is_client_kyc",
  "idea_text": "Client KYC checks take us days because the onboarding team gathers ID documents by email, checks them by hand and runs screening separately. I want something that collects the KYC documents from new clients, verifies the IDs, runs the sanctions and PEP screening and gives a risk rating, so we only look at the cases that need a human.",
  "phase": "done",
  "status": "completed",
  "started_at": "2026-10-05T09:00:00Z",
  "timeline": [
    {
      "seq": 0,
      "kind": "turn",
      "phase": "discover",
      "at": "2026-10-05T09:00:00Z",
      "process": "as_is",
      "turn": "T0",
      "target": {
        "kind": "idea",
        "id": "idea"
      },
      "answer": {
        "by": "user_sarah_lin",
        "text": "Client KYC checks take us days because the onboarding team gathers ID documents by email, checks them by hand and runs screening separately. I want something that collects the KYC documents from new clients, verifies the IDs, runs the sanctions and PEP screening and gives a risk rating, so we only look at the cases that need a human."
      },
      "captured": [
        "Mode: a process exists today, so I'll capture how it works now first",
        "Goal: cut the time it takes to complete KYC for a new client",
        "Roles: Onboarding Analyst; Client",
        "Today's steps: Request KYC documents (by email) · Verify identity documents (by hand) · Screen client and owners (separately) · Assign risk rating",
        "Pain points noted: email, manual ID checks, separate screening"
      ],
      "assumptions": [
        "KYC means 'know your client' checks on the client and its owners"
      ],
      "ops": [
        {
          "op": "add",
          "path": "/nodes/node_screen",
          "value": {
            "type": "task",
            "name": "Screen client and owners",
            "description": "Run sanctions and PEP screening on the client and its owners.",
            "automation_hint": "integration",
            "as_is_effort": {
              "pain_points": [
                "Screening run separately from the other checks"
              ]
            },
            "meta": {
              "status": "proposed",
              "confidence": 0.0,
              "provenance": [
                {
                  "source_id": "src_intake_is_client_kyc",
                  "locator": {
                    "kind": "turn",
                    "value": "T0"
                  },
                  "excerpt": "runs screening separately",
                  "stance": "supports",
                  "extraction_certainty": 0.9
                }
              ]
            }
          }
        },
        {
          "op": "add",
          "path": "/nodes/node_risk_rate",
          "value": {
            "type": "task",
            "name": "Assign risk rating",
            "description": "Give the client a KYC risk rating.",
            "outputs": [
              "ent_risk_assessment"
            ],
            "automation_hint": "deterministic_code",
            "meta": {
              "status": "proposed",
              "confidence": 0.0,
              "provenance": [
                {
                  "source_id": "src_intake_is_client_kyc",
                  "locator": {
                    "kind": "turn",
                    "value": "T0"
                  },
                  "excerpt": "gives a risk rating",
                  "stance": "supports",
                  "extraction_certainty": 0.9
                }
              ]
            }
          }
        },
        {
          "op": "add",
          "path": "/nodes/node_request_docs",
          "value": {
            "type": "task",
            "name": "Request KYC documents",
            "description": "Ask the new client for their ID documents by email.",
            "automation_hint": "integration",
            "as_is_effort": {
              "pain_points": [
                "ID documents gathered by email"
              ]
            },
            "meta": {
              "status": "proposed",
              "confidence": 0.0,
              "provenance": [
                {
                  "source_id": "src_intake_is_client_kyc",
                  "locator": {
                    "kind": "turn",
                    "value": "T0"
                  },
                  "excerpt": "gathers ID documents by email",
                  "stance": "supports",
                  "extraction_certainty": 0.9
                }
              ]
            }
          }
        },
        {
          "op": "add",
          "path": "/nodes/node_verify_id",
          "value": {
            "type": "task",
            "name": "Verify identity documents",
            "description": "Check the identity documents by hand.",
            "automation_hint": "integration",
            "as_is_effort": {
              "pain_points": [
                "IDs checked by hand"
              ]
            },
            "meta": {
              "status": "proposed",
              "confidence": 0.0,
              "provenance": [
                {
                  "source_id": "src_intake_is_client_kyc",
                  "locator": {
                    "kind": "turn",
                    "value": "T0"
                  },
                  "excerpt": "checks them by hand",
                  "stance": "supports",
                  "extraction_certainty": 0.9
                }
              ]
            }
          }
        },
        {
          "op": "add",
          "path": "/actors/act_client",
          "value": {
            "name": "Client",
            "kind": "external_party",
            "meta": {
              "status": "proposed",
              "confidence": 0.0,
              "provenance": [
                {
                  "source_id": "src_intake_is_client_kyc",
                  "locator": {
                    "kind": "turn",
                    "value": "T0"
                  },
                  "excerpt": "new clients",
                  "stance": "supports",
                  "extraction_certainty": 0.8
                }
              ]
            }
          }
        },
        {
          "op": "add",
          "path": "/actors/act_onboarding_analyst",
          "value": {
            "name": "Onboarding Analyst",
            "kind": "human_role",
            "meta": {
              "status": "proposed",
              "confidence": 0.0,
              "provenance": [
                {
                  "source_id": "src_intake_is_client_kyc",
                  "locator": {
                    "kind": "turn",
                    "value": "T0"
                  },
                  "excerpt": "the onboarding team",
                  "stance": "supports",
                  "extraction_certainty": 0.8
                }
              ]
            }
          }
        },
        {
          "op": "add",
          "path": "/entities/ent_risk_assessment",
          "value": {
            "name": "Risk assessment",
            "attributes": [
              {
                "name": "rating",
                "type": "enum",
                "required": true,
                "pii": false,
                "enum_values": [
                  "low",
                  "medium",
                  "high"
                ]
              }
            ],
            "meta": {
              "status": "proposed",
              "confidence": 0.0,
              "provenance": [
                {
                  "source_id": "src_intake_is_client_kyc",
                  "locator": {
                    "kind": "turn",
                    "value": "T0"
                  },
                  "excerpt": "a risk rating",
                  "stance": "supports",
                  "extraction_certainty": 0.9
                }
              ]
            }
          }
        },
        {
          "op": "add",
          "path": "/goals/goal_faster_kyc",
          "value": {
            "statement": "Cut the time it takes to complete KYC for a new client",
            "metrics": [],
            "meta": {
              "status": "proposed",
              "confidence": 0.0,
              "provenance": [
                {
                  "source_id": "src_intake_is_client_kyc",
                  "locator": {
                    "kind": "turn",
                    "value": "T0"
                  },
                  "excerpt": "Client KYC checks take us days",
                  "stance": "supports",
                  "extraction_certainty": 0.9
                }
              ]
            }
          }
        },
        {
          "op": "add",
          "path": "/glossary/term_kyc",
          "value": {
            "term": "KYC",
            "definition": "Know your client: checks that confirm who a client and its owners are, and the risk they pose.",
            "ambiguous": false,
            "meta": {
              "status": "proposed",
              "confidence": 0.0,
              "provenance": [
                {
                  "source_id": "src_intake_is_client_kyc",
                  "locator": {
                    "kind": "turn",
                    "value": "T0"
                  },
                  "excerpt": "Client KYC checks",
                  "stance": "supports",
                  "extraction_certainty": 0.8
                },
                {
                  "source_id": "src_inferred",
                  "locator": {
                    "kind": "none",
                    "value": ""
                  },
                  "stance": "supports",
                  "extraction_certainty": 0.8
                }
              ]